,authorDisplayName,authorProfileImageUrl,textDisplay,textOriginal,likeCount,publishedAt,dbscanned
0,진용진,https://yt3.ggpht.com/ytc/AKedOLQZDV-yDWNZbxl8HFifJ3ADj5Bb5nd1r4DNhrksjg=s48-c-k-c0x00ffffff-no-rj,"당신의 없는 영화는 무엇인가요?<br><br><br>배우지원, 광고문의 - jinyongjin.yt@<a href=""http://gmail.com/"">gmail.com</a><br>없는영화 풀버전 업로드 - <a href=""https://abit.ly/detail_studio_yt"">https://abit.ly/detail_studio_yt</a>","당신의 없는 영화는 무엇인가요?


배우지원, 광고문의 - jinyongjin.yt@gmail.com
없는영화 풀버전 업로드 - https://abit.ly/detail_studio_yt",489,20211208,-1
388,Hyeonki Lee,https://yt3.ggpht.com/ytc/AKedOLRPKyj5xvIXAR8f4FnyIYIWPcu4ScL2a0f8WPc-Eg=s48-c-k-c0x00ffffff-no-rj,남자가 피임약을 복용하면 어떻게 되는지 궁금해요,남자가 피임약을 복용하면 어떻게 되는지 궁금해요,0,20211208,-1
398,불나방,https://yt3.ggpht.com/0xGCP7slNtRkNINfq1lGLLOKfNSOnEMwYH2BRu9hnqdTejZpdggeg0oK6w4g_yGMka-pfqv2eg=s48-c-k-c0x00ffffff-no-rj,다음편 너무 기대됩니다.<br><br>언제 업로드 되나요?,"다음편 너무 기대됩니다.

언제 업로드 되나요?",0,20211208,-1
433,우영웅,https://yt3.ggpht.com/ytc/AKedOLSfg6aaaTCqWGWnciaVcIA2l3iEs249NkPkrzrUaA=s48-c-k-c0x00ffffff-no-rj,교복을 입고 자면 나라도 불면증 걸릴듯?,교복을 입고 자면 나라도 불면증 걸릴듯?,0,20211208,-1
451,쉽지않아,https://yt3.ggpht.com/ytc/AKedOLTgky85Rg3l_z4OyyE4yqcWMxtBLq6G8T_r5w=s48-c-k-c0x00ffffff-no-rj,꿈속에서 멈춰하면 진짜 멈춰지나요?,꿈속에서 멈춰하면 진짜 멈춰지나요?,0,20211208,-1
466,수박바,https://yt3.ggpht.com/WD8s5ihHfkWk9Uhq2glpOSv2GfYmZHTQVvrQDPEuhC6w8-er88eZpWk4KXlUW5vnwFhOdzUi=s48-c-k-c0x00ffffff-no-rj,요즘 영화줄거리영상을 너무재미있게보고있는데 진짜 영화한편보고온기분이에요. 없는영화 계속 보고싶어요!!<br>저는 결말포함영상을 좋아하지만 어떻게되는지 풀영상도 보고오겠습니다.,"요즘 영화줄거리영상을 너무재미있게보고있는데 진짜 영화한편보고온기분이에요. 없는영화 계속 보고싶어요!!
저는 결말포함영상을 좋아하지만 어떻게되는지 풀영상도 보고오겠습니다.",2,20211208,-1
474,Min Hyeok,https://yt3.ggpht.com/ytc/AKedOLTSXyGDMhKNAze8LgYa9kv_9j0-i2DPp5VsFkK7=s48-c-k-c0x00ffffff-no-rj,궁금합니다 아파트 거실에서 바닥을 뚫으면 바로 아래층이 보이는지 궁금합니다 확인 해주시면 감사하겠습니다,궁금합니다 아파트 거실에서 바닥을 뚫으면 바로 아래층이 보이는지 궁금합니다 확인 해주시면 감사하겠습니다,0,20211208,-1
482,miumiumiumiu,https://yt3.ggpht.com/ytc/AKedOLRcFJpEZh1OyHkphao4MSFg7qs5d0AEPLHuyA=s48-c-k-c0x00ffffff-no-rj,1. 저렇게 뺏기면서도 또 돈을 들고 다니는 이유는?<br>2. 뜬금없이 모르는 약을 수면제라고 생각하는 이유는?<br>3. 누가 봐도 자기한테 비아냥대는 남자애를 좋아하는 이유는?,"1. 저렇게 뺏기면서도 또 돈을 들고 다니는 이유는?
2. 뜬금없이 모르는 약을 수면제라고 생각하는 이유는?
3. 누가 봐도 자기한테 비아냥대는 남자애를 좋아하는 이유는?",0,20211208,-1
497,Ss KK,https://yt3.ggpht.com/ytc/AKedOLSgdIZUxVS8l1Iw25Dn-edISLy27Ygtec2NDhD9=s48-c-k-c0x00ffffff-no-rj,꿈에서 제 루시드 주식좀 살려주세요.,꿈에서 제 루시드 주식좀 살려주세요.,1,20211208,-1
521,가가미,https://yt3.ggpht.com/ytc/AKedOLS9AltOVbMhQa3EzRO5gMTlLRZdeABHIe-ZwM_ZCg=s48-c-k-c0x00ffffff-no-rj,심리상담가끼리모여서 돈을걸고 협상등 게임하는 영상 만들어주세요!,심리상담가끼리모여서 돈을걸고 협상등 게임하는 영상 만들어주세요!,0,20211208,-1
533,오지용,https://yt3.ggpht.com/ytc/AKedOLSJf0MXp5TCL6eRSrMDsNhWzqCD0QIWoel02A=s48-c-k-c0x00ffffff-no-rj,와 …몰입감 개쩔어.…용진님의 한계는 <br>어디까지인가요,"와 …몰입감 개쩔어.…용진님의 한계는 
어디까지인가요",3,20211208,-1
534,김대원,https://yt3.ggpht.com/ytc/AKedOLT1J8uTIoU7cmdiMen1EvB0g8RWYYmFFAxWww=s48-c-k-c0x00ffffff-no-rj,빨간불에서 초록불로 바뀔때 똑같이 엑셀 밟으면서 차가 갈 수 있을까요,빨간불에서 초록불로 바뀔때 똑같이 엑셀 밟으면서 차가 갈 수 있을까요,1,20211208,-1
564,웃음,https://yt3.ggpht.com/ytc/AKedOLSTvbS0NWvNJr2-67xvzUc_SXe108mtY5LgW4TQ=s48-c-k-c0x00ffffff-no-rj,SNS에서 유행하는 위피앱을 깔면 연애를할수있는게 사실인지 알려주세요,SNS에서 유행하는 위피앱을 깔면 연애를할수있는게 사실인지 알려주세요,0,20211208,-1
578,알파,https://yt3.ggpht.com/9Lxr5NYC52_eja5MbvQWRs-y8IAmZIvFrtkUHTStSXYbTbl-X8OUK_ezlf_xVshLt-BJNwP0SQ=s48-c-k-c0x00ffffff-no-rj,루시드드림 조언을좀 받으셔야겟는데요 ㅎㅎ 디테일이... 조언해드릴수있습니다.,루시드드림 조언을좀 받으셔야겟는데요 ㅎㅎ 디테일이... 조언해드릴수있습니다.,0,20211208,-1
589,뭐,https://yt3.ggpht.com/lWeOwS_mQu2t64r27UMDN_0GRBl6DAeL8U0s4sHM2-YdJihjwSyB78hqSmG-pmZKl8WO0ovgM2o=s48-c-k-c0x00ffffff-no-rj,나도 주기적으로 루시드드림이루어 지는데 나는 신인가?,나도 주기적으로 루시드드림이루어 지는데 나는 신인가?,0,20211208,-1
605,뭉쿠,https://yt3.ggpht.com/ytc/AKedOLQojGaqOvSnY6hr_r5N2B9xtRVaYynteTE-1qwSxQ=s48-c-k-c0x00ffffff-no-rj,요 컨텐츠 만드려고 배우들 연기 한건가요? 아니면 있는 영상 짜집기 한거예요?? 배우들 섭외해서 만든 영상이면 진짜 레전드네요..,요 컨텐츠 만드려고 배우들 연기 한건가요? 아니면 있는 영상 짜집기 한거예요?? 배우들 섭외해서 만든 영상이면 진짜 레전드네요..,5,20211208,-1
620,네임네임2,https://yt3.ggpht.com/ytc/AKedOLROoemldf0woRjcwPExs5Sd3ODbpQhsK3AhO9hO=s48-c-k-c0x00ffffff-no-rj,혹시 작가가 아닌 배우로 나가실 의향이 있으신가요?,혹시 작가가 아닌 배우로 나가실 의향이 있으신가요?,0,20211208,-1
659,박상호,https://yt3.ggpht.com/ytc/AKedOLQ9kP9lkm-7ywJguJPUIlj1aUZrZZuXl7HqMg=s48-c-k-c0x00ffffff-no-rj,한국의 입셉션같은 느낌이랄까?...,한국의 입셉션같은 느낌이랄까?...,0,20211208,-1
678,파초,https://yt3.ggpht.com/ytc/AKedOLRJe_jlNvSzSfjPELmx1yJ3gYuwCZlEr8WdlQ=s48-c-k-c0x00ffffff-no-rj,대박..재밌는데요? 영화로 만들어보죠,대박..재밌는데요? 영화로 만들어보죠,0,20211208,-1
723,네이웃을사랑하라,https://yt3.ggpht.com/ytc/AKedOLS9ABgFaZoHIRFjxkz_eGVAvHAdImQxz7FSG3yPog=s48-c-k-c0x00ffffff-no-rj,풀버전 언제나오나요?,풀버전 언제나오나요?,0,20211208,-1
729,sunyoung eum,https://yt3.ggpht.com/ytc/AKedOLS0YuYShFwxSA6oRNoB3KuBiB5_rT0Vq9W-cQ=s48-c-k-c0x00ffffff-no-rj,우와 너무 속시원하고 재미있어요. 시리즈로 계속 만들어주세요,우와 너무 속시원하고 재미있어요. 시리즈로 계속 만들어주세요,1,20211208,-1
757,섬딤섬,https://yt3.ggpht.com/ytc/AKedOLToQSyiH2LbrzYkpPg-WNloLp4IjHcJk0MLRg=s48-c-k-c0x00ffffff-no-rj,오 개꿀잼ㅋㅋㅋㅋ다음화 있는거에요? 아님 열린결말인가요?,오 개꿀잼ㅋㅋㅋㅋ다음화 있는거에요? 아님 열린결말인가요?,1,20211208,-1
792,이승태,https://yt3.ggpht.com/ytc/AKedOLTnD5dJJAmpWLg0oV1sAw68fUic0qfQw5Pm4S5vxQ=s48-c-k-c0x00ffffff-no-rj,너무너무 재밌어요 대박...<br>앞으로 이런 것 좀 많이 올려주세요ㅜ,"너무너무 재밌어요 대박...
앞으로 이런 것 좀 많이 올려주세요ㅜ",10,20211208,-1
837,이름성,https://yt3.ggpht.com/ytc/AKedOLSdAE98cKjH0fx_qRgRmNNfiZ49yCit-ZY2nMqU=s48-c-k-c0x00ffffff-no-rj,여기 영화리뷰 채널인가요?,여기 영화리뷰 채널인가요?,0,20211208,-1
864,댓글만 써서 구독자 1000명 찍기,https://yt3.ggpht.com/Vk1Plk_4jCgmU6M1XaNLlZRvMjTb4OyozzLyLhb60jqxPwT8SeJ7wVRfQpPOyV28M7RyT0rfrqE=s48-c-k-c0x00ffffff-no-rj,이번에는 영화리뷰 컨셉인가요.,이번에는 영화리뷰 컨셉인가요.,0,20211208,-1
884,Jin,https://yt3.ggpht.com/ytc/AKedOLTy4Z75MY7HB2zRyQjYRvUBgXgcj_f9OqHIsdIT=s48-c-k-c0x00ffffff-no-rj,형님이 왜 이 영화에 왜 나오세요?,형님이 왜 이 영화에 왜 나오세요?,0,20211208,-1
378,Teblar,https://yt3.ggpht.com/ytc/AKedOLTBq_D7sWYVuldsrge8yinz0sXUJTAiX07pyNN9yw=s48-c-k-c0x00ffffff-no-rj,이분들 일반인 인가요 배우분들인가요??,이분들 일반인 인가요 배우분들인가요??,0,20211208,-1
374,어디로가야하오,https://yt3.ggpht.com/ytc/AKedOLRnw7Ctj5N8VtUrWjfwMdqId2aKYJLF8tJMQg=s48-c-k-c0x00ffffff-no-rj,와 진짜 있는 영화인줄 알고 봤는데 단편영화로 제작 해주셔야 되겠는데요?,와 진짜 있는 영화인줄 알고 봤는데 단편영화로 제작 해주셔야 되겠는데요?,0,20211208,-1
365,배고픈빅맥,https://yt3.ggpht.com/ytc/AKedOLRmGa8-3fyx9T8ErnJCcoOxRWQ6fyncZ-Ydlg=s48-c-k-c0x00ffffff-no-rj,로또 1등 당첨번호 알려줘!!!,로또 1등 당첨번호 알려줘!!!,0,20211208,-1
347,코난슐렌키,https://yt3.ggpht.com/ytc/AKedOLTKAZzWEXdxDmtynSOq_3_aRu4bupyZP2pJvrQnSR8=s48-c-k-c0x00ffffff-no-rj,없는영화 주제 평행세계로 빅현배가 머니게임에서 자진퇴소 안했으면 어떻게 됐을지 찍어주세요,없는영화 주제 평행세계로 빅현배가 머니게임에서 자진퇴소 안했으면 어떻게 됐을지 찍어주세요,0,20211208,-1
7,잼 ꪜ,https://yt3.ggpht.com/ytc/AKedOLSNLqcf6NI8hkSAkEE4k9TbQK5USfT_atdXgNodMA=s48-c-k-c0x00ffffff-no-rj,거.. 진용진씨 영화좀 만들어주세요,거.. 진용진씨 영화좀 만들어주세요,0,20211210,-1
14,Mr. ༺{ KIM }༻,https://yt3.ggpht.com/ytc/AKedOLRypbY7Oh491dBbyBk6sXwiQTLjYS585d8julnIkQ=s48-c-k-c0x00ffffff-no-rj,길거리 결혼전단지 붙은거에대해 알려주세요,길거리 결혼전단지 붙은거에대해 알려주세요,0,20211210,-1
19,john kim,https://yt3.ggpht.com/ytc/AKedOLQbSn-dePhkKZFpqaOUOVEGvEjZmFT7eF1Ys2g6xQ=s48-c-k-c0x00ffffff-no-rj,루시드 어드벤쳐에 열렙전사도 현실에서 좀 살려주세요,루시드 어드벤쳐에 열렙전사도 현실에서 좀 살려주세요,0,20211210,-1
25,느타리리님한판해요,https://yt3.ggpht.com/ytc/AKedOLR9W_xY_UHOjU0Iukgd7jo55jux_Uo7cRnV2-1SOw=s48-c-k-c0x00ffffff-no-rj,광고에선 왜 항상 99.9퍼센트 일까?,광고에선 왜 항상 99.9퍼센트 일까?,1,20211210,-1
29,희망이,https://yt3.ggpht.com/ytc/AKedOLR2giPfY0HoXtnr94dK8zHketdpPl6oHPAwULou=s48-c-k-c0x00ffffff-no-rj,응급실 떡볶이 먹고 응급실 간 사람 있을까요,응급실 떡볶이 먹고 응급실 간 사람 있을까요,1,20211210,-1
36,qwp,https://yt3.ggpht.com/gIUpbb9R8N7I62Fu4khOWbSGeFDpTil1UKHiP91VBJDaEtfdJ4-KLqCDVBme1rCH5Vg1Q4EL2Q=s48-c-k-c0x00ffffff-no-rj,자! 이제 영화 요약하시는 유튜버분들은 이걸 또다시 요약해주세요,자! 이제 영화 요약하시는 유튜버분들은 이걸 또다시 요약해주세요,0,20211210,-1
39,김소윤,https://yt3.ggpht.com/ytc/AKedOLSwZV5IpVeL0qG6AFt_pw1A_RuiA8XCdtxJQA=s48-c-k-c0x00ffffff-no-rj,갑자기 궁금한건데 대중교통 버스가 언제 생겼는지 다니는 구역을 어떻게 나눴는지 번호는 어떻게 장해진건지 궁금해요,갑자기 궁금한건데 대중교통 버스가 언제 생겼는지 다니는 구역을 어떻게 나눴는지 번호는 어떻게 장해진건지 궁금해요,1,20211210,-1
50,에엥,https://yt3.ggpht.com/ytc/AKedOLQdHi0xYUbTnCNb9JuYwyoDGNdMA0qi-5clGZ0BGQ=s48-c-k-c0x00ffffff-no-rj,개똥벌레는 왜 친구가 없나요?,개똥벌레는 왜 친구가 없나요?,0,20211210,-1
71,Kim James,https://yt3.ggpht.com/ytc/AKedOLSeRZjy-e4c2ocv1GRBnFhJQgs_ln3YsCarRNCP=s48-c-k-c0x00ffffff-no-rj,이 영화 진용진님 채널에 풀버젼으로 공개되는거죠?,이 영화 진용진님 채널에 풀버젼으로 공개되는거죠?,1,20211209,-1
92,수영하는건달프,https://yt3.ggpht.com/ytc/AKedOLRZBFWUghOFYUMdmyns9eP5KfgPdaaYvaDZCw=s48-c-k-c0x00ffffff-no-rj,옛날에 통아저씨로 유명하신던분 요즘엔 어떻게 지내시는지 궁금합니다.,옛날에 통아저씨로 유명하신던분 요즘엔 어떻게 지내시는지 궁금합니다.,0,20211209,-1
121,sunny sunny,https://yt3.ggpht.com/ytc/AKedOLSFbE4FvitvPA8M0xj84FO88RZQ5PyUk2Difg=s48-c-k-c0x00ffffff-no-rj,저 알약 어디서 구하나요?,저 알약 어디서 구하나요?,0,20211209,-1
122,지민,https://yt3.ggpht.com/ytc/AKedOLR7C4vgxMREDHi5A7MLCZfO9OgoQXkKhyoALY2xLg=s48-c-k-c0x00ffffff-no-rj,"<a href=""https://www.youtube.com/watch?v=_EX71hJsN2c&amp;t=1m42s"">1:42</a> 이 부분에 부자연스럽게 끊겼다가 연결되는 부분이 있는데 혹시 제 핸드폰 문젠가요..?",1:42 이 부분에 부자연스럽게 끊겼다가 연결되는 부분이 있는데 혹시 제 핸드폰 문젠가요..?,1,20211209,-1
892,ᄀᄃᄀ,https://yt3.ggpht.com/ytc/AKedOLRrTOuxuUJ3I5TG25Tgj7FH78Y41bs93vhVok3TnA=s48-c-k-c0x00ffffff-no-rj,금수저들도 백신맞고 안아파도 학교를 안나가는지 궁금합니다,금수저들도 백신맞고 안아파도 학교를 안나가는지 궁금합니다,2,20211208,-1
126,물병자리시대,https://yt3.ggpht.com/ytc/AKedOLTLf2_6dX1lO2Cjg7EmqjASwK_HS996Z9n7lxS8ng=s48-c-k-c0x00ffffff-no-rj,대박ㅋㅋ 머니게임2 만들어주세요. 또 더 지니어스 진용진버전으로만들어주시면안됨 이런컨텐츠 두팔벌려환영,대박ㅋㅋ 머니게임2 만들어주세요. 또 더 지니어스 진용진버전으로만들어주시면안됨 이런컨텐츠 두팔벌려환영,0,20211209,-1
149,아,https://yt3.ggpht.com/fVyn3l9wSIVMms0UhHz9F7JaZS5E6Ip62H5VqE4Ihkk0lmgoBuApZaqd5vbW_h0LQAmaxHDDHA=s48-c-k-c0x00ffffff-no-rj,dark이 사람 정체가 궁금합니다,dark이 사람 정체가 궁금합니다,0,20211209,-1
154,david,https://yt3.ggpht.com/ytc/AKedOLRrV2qAFfq2J3UqdF4fBS69oOxa3fKy6bW38iNRjw=s48-c-k-c0x00ffffff-no-rj,저 진용진님 혹시 없는 영화에 &quot;뇌파 vs 초음파 &quot; 도 리뷰 해주시나요 ?,"저 진용진님 혹시 없는 영화에 ""뇌파 vs 초음파 "" 도 리뷰 해주시나요 ?",1,20211209,-1
159,수은,https://yt3.ggpht.com/kV_Mw0pismrQOt3dypOFfle6ziASWzRV2Sw9_wa1E1c44EkUXKd-0iwLIymztGmhbqz2-xuP=s48-c-k-c0x00ffffff-no-rj,진용진님 리얼다큐 진용진의일기장 해주시면 않될까요 부탁드립니다 🙏,진용진님 리얼다큐 진용진의일기장 해주시면 않될까요 부탁드립니다 🙏,0,20211209,-1
167,우우,https://yt3.ggpht.com/urzhdoiZqNitNEeDw0tmwCYKJKec3p1g-crEJ6-AWdMfT2TKgMUQ9eBUMAIvQTUVvG07ELeJEw=s48-c-k-c0x00ffffff-no-rj,박항서 감독님은 베트남vs한국 축구 친선전을하면 속으로 한국을 응원할까??? ㅋㅋㅋㅋㅋㅋㅋㅋㅋㅋㅋㅋㅋㅋ,박항서 감독님은 베트남vs한국 축구 친선전을하면 속으로 한국을 응원할까??? ㅋㅋㅋㅋㅋㅋㅋㅋㅋㅋㅋㅋㅋㅋ,1,20211209,-1
223,true hope,https://yt3.ggpht.com/ytc/AKedOLRVm4l2TJg6XB-iUef9lFUwEILUaYA8kDLOsn1GXA=s48-c-k-c0x00ffffff-no-rj,"와우, 너~~~~~~~~무 마음에 들어요. 이 컨텐츠 오래오래 보고싶습니다👏👏👏💜💜💜","와우, 너~~~~~~~~무 마음에 들어요. 이 컨텐츠 오래오래 보고싶습니다👏👏👏💜💜💜",0,20211209,-1
225,joozul2,https://yt3.ggpht.com/ytc/AKedOLTyY2Slxo7pgNG-4nkKWGu2wazuSaqKv225ABliIA=s48-c-k-c0x00ffffff-no-rj,루시드로 화성갈수있나요?,루시드로 화성갈수있나요?,0,20211209,-1
246,ㅇㅎㄱ렇군,https://yt3.ggpht.com/ytc/AKedOLR1iRL22EAOx09DtV_5tRQW7VgvziPIsftr_qJEsijRgg=s48-c-k-c0x00ffffff-no-rj,"그것을 알려드림 제보 합니다.<br><br>sns에 돌아다니는 키스권, 노예 이용권 같이 기프티콘 모양을 하고있는것들은 어떤 상품의 코드인지 궁금합니다.","그것을 알려드림 제보 합니다.

sns에 돌아다니는 키스권, 노예 이용권 같이 기프티콘 모양을 하고있는것들은 어떤 상품의 코드인지 궁금합니다.",0,20211208,-1
268,Mr.쏭 TV,https://yt3.ggpht.com/ytc/AKedOLSY6ycJTBqFLy2I_rjnKw6sNAbIMo4u3mn_Tg=s48-c-k-c0x00ffffff-no-rj,운전 가르쳐 주시는 유튜버분들이나 생활의 달인에 운전의 달인으로 나오셨던 분들은 에스컬레이드로 여의도  성모병원을 들어갔다 나올 수 있는지 궁금합니다.,운전 가르쳐 주시는 유튜버분들이나 생활의 달인에 운전의 달인으로 나오셨던 분들은 에스컬레이드로 여의도  성모병원을 들어갔다 나올 수 있는지 궁금합니다.,1,20211208,-1
274,이정수,https://yt3.ggpht.com/rHhe-SEiGxBF7Hel0uDHQ_dYz94sm9xbegOgtiomIFyXlD8z7wA2m77JxjewyPrk_iPizv10og=s48-c-k-c0x00ffffff-no-rj,클릭해주셔서감사합니다,클릭해주셔서감사합니다,0,20211208,-1
298,지식채널 사이리우스 ,https://yt3.ggpht.com/z7ZXg_jOGsQcZd_WRiH1PIDnjz00m-5r6Vq7w91YBnK7oI_u0HuLOMJsYEBqVRGDPZp8TK9_Lw=s48-c-k-c0x00ffffff-no-rj,이런 아이디어는 어디서 나오시는건지 ㄷㄷ;,이런 아이디어는 어디서 나오시는건지 ㄷㄷ;,0,20211208,-1
317,이누가영,https://yt3.ggpht.com/ytc/AKedOLQgFqNFnGPKzDReAJ3R8HJDAtyoLyUg3cTv4UAZ=s48-c-k-c0x00ffffff-no-rj,근데 왜 아빠가 다짜고짜 꿈에서 딸에게 싸다구 갈기는거지?,근데 왜 아빠가 다짜고짜 꿈에서 딸에게 싸다구 갈기는거지?,0,20211208,-1
337,Sean Mc,https://yt3.ggpht.com/ytc/AKedOLS-JkS_feZXypHhczJOKUxE3CMCLC_vwaKux-crfSToTVTST9-FUY3kCVSeFEZ0=s48-c-k-c0x00ffffff-no-rj,예고편 잘봤습니다 <br>그래서 영화관에서 언제 개봉해요?,"예고편 잘봤습니다 
그래서 영화관에서 언제 개봉해요?",1,20211208,-1
138,태정태세비욘세,https://yt3.ggpht.com/ytc/AKedOLSSALHue4syoTpQOHtEXbQNo2HsPd-oRCpKc7mQAA=s48-c-k-c0x00ffffff-no-rj,주제추천: 맞춤법 훈수 두는 사람들은 본인들은 모든 맞춤법을 알고 있을까?,주제추천: 맞춤법 훈수 두는 사람들은 본인들은 모든 맞춤법을 알고 있을까?,1,20211209,-1
927,나,https://yt3.ggpht.com/ojFg-H_6Mu4jN4oyC9mTmuaThHp0YaTi_ExZO6h2Mo4DvRL4d3nwgAu-onP47aAgB07-uNGCYA=s48-c-k-c0x00ffffff-no-rj,주제 추천 : 중성은 남자화장실에 갈까 여자화장실에 갈까,주제 추천 : 중성은 남자화장실에 갈까 여자화장실에 갈까,5,20211208,-1
